{
  "version": "0.1.0",
  "source": "OWASP Autonomous Penetration Testing Standard",
  "last_updated": "2026-04-26T10:41:06Z",
  "requirements": [
    {
      "id": "APTS-SE-001",
      "domain": "Scope Enforcement",
      "tier": 1,
      "classification": "MUST",
      "title": "Rules of Engagement (RoE) Specification and Validation"
    },
    {
      "id": "APTS-SE-002",
      "domain": "Scope Enforcement",
      "tier": 1,
      "classification": "MUST",
      "title": "IP Range Validation and RFC 1918 Awareness"
    },
    {
      "id": "APTS-SE-003",
      "domain": "Scope Enforcement",
      "tier": 1,
      "classification": "MUST",
      "title": "Domain Scope Validation and Wildcard Handling"
    },
    {
      "id": "APTS-SE-004",
      "domain": "Scope Enforcement",
      "tier": 1,
      "classification": "MUST",
      "title": "Temporal Boundary and Timezone Handling"
    },
    {
      "id": "APTS-SE-005",
      "domain": "Scope Enforcement",
      "tier": 1,
      "classification": "MUST",
      "title": "Asset Criticality Classification and Integration"
    },
    {
      "id": "APTS-SE-006",
      "domain": "Scope Enforcement",
      "tier": 1,
      "classification": "MUST",
      "title": "Pre-Action Scope Validation"
    },
    {
      "id": "APTS-SE-007",
      "domain": "Scope Enforcement",
      "tier": 2,
      "classification": "MUST",
      "title": "Dynamic Scope Monitoring and Drift Detection"
    },
    {
      "id": "APTS-SE-008",
      "domain": "Scope Enforcement",
      "tier": 1,
      "classification": "MUST",
      "title": "Temporal Scope Compliance Monitoring"
    },
    {
      "id": "APTS-SE-009",
      "domain": "Scope Enforcement",
      "tier": 1,
      "classification": "MUST",
      "title": "Hard Deny Lists and Critical Asset Protection"
    },
    {
      "id": "APTS-SE-010",
      "domain": "Scope Enforcement",
      "tier": 2,
      "classification": "MUST",
      "title": "Production Database Safeguards"
    },
    {
      "id": "APTS-SE-011",
      "domain": "Scope Enforcement",
      "tier": 2,
      "classification": "SHOULD",
      "title": "Multi-Tenant Environment Awareness"
    },
    {
      "id": "APTS-SE-012",
      "domain": "Scope Enforcement",
      "tier": 2,
      "classification": "MUST",
      "title": "DNS Rebinding Attack Prevention"
    },
    {
      "id": "APTS-SE-013",
      "domain": "Scope Enforcement",
      "tier": 2,
      "classification": "MUST",
      "title": "Network Boundary and Lateral Movement Enforcement"
    },
    {
      "id": "APTS-SE-014",
      "domain": "Scope Enforcement",
      "tier": 2,
      "classification": "SHOULD",
      "title": "Network Topology Discovery Limitations"
    },
    {
      "id": "APTS-SE-015",
      "domain": "Scope Enforcement",
      "tier": 1,
      "classification": "MUST",
      "title": "Scope Enforcement Audit and Compliance Verification"
    },
    {
      "id": "APTS-SE-016",
      "domain": "Scope Enforcement",
      "tier": 2,
      "classification": "MUST",
      "title": "Scope Refresh and Revalidation Cycle"
    },
    {
      "id": "APTS-SE-017",
      "domain": "Scope Enforcement",
      "tier": 2,
      "classification": "MUST",
      "title": "Engagement Boundary Definition for Recurring Tests"
    },
    {
      "id": "APTS-SE-018",
      "domain": "Scope Enforcement",
      "tier": 2,
      "classification": "SHOULD",
      "title": "Cross-Cycle Finding Correlation and Regression Detection"
    },
    {
      "id": "APTS-SE-019",
      "domain": "Scope Enforcement",
      "tier": 2,
      "classification": "MUST",
      "title": "Rate Limiting, Adaptive Backoff, and Production Impact Controls"
    },
    {
      "id": "APTS-SE-020",
      "domain": "Scope Enforcement",
      "tier": 2,
      "classification": "MUST",
      "title": "Deployment-Triggered Testing Governance"
    },
    {
      "id": "APTS-SE-021",
      "domain": "Scope Enforcement",
      "tier": 3,
      "classification": "SHOULD",
      "title": "Scope Conflict Resolution for Overlapping Engagements"
    },
    {
      "id": "APTS-SE-022",
      "domain": "Scope Enforcement",
      "tier": 2,
      "classification": "SHOULD",
      "title": "Client-Side Agent Scope and Safety Boundaries"
    },
    {
      "id": "APTS-SE-023",
      "domain": "Scope Enforcement",
      "tier": 2,
      "classification": "MUST",
      "title": "Credential and Secret Lifecycle Governance"
    },
    {
      "id": "APTS-SE-024",
      "domain": "Scope Enforcement",
      "tier": 2,
      "classification": "MUST",
      "title": "Cloud-Native and Ephemeral Infrastructure Governance"
    },
    {
      "id": "APTS-SE-025",
      "domain": "Scope Enforcement",
      "tier": 2,
      "classification": "MUST",
      "title": "API-First and Business Logic Testing Governance"
    },
    {
      "id": "APTS-SE-026",
      "domain": "Scope Enforcement",
      "tier": 2,
      "classification": "SHOULD",
      "title": "Out-of-Distribution Action Monitoring"
    },
    {
      "id": "APTS-SC-001",
      "domain": "Safety Controls",
      "tier": 1,
      "classification": "MUST",
      "title": "Impact Classification and CIA Scoring"
    },
    {
      "id": "APTS-SC-002",
      "domain": "Safety Controls",
      "tier": 2,
      "classification": "MUST",
      "title": "Industry-Specific Impact Considerations"
    },
    {
      "id": "APTS-SC-003",
      "domain": "Safety Controls",
      "tier": 2,
      "classification": "SHOULD",
      "title": "Real-World Impact Classification Examples"
    },
    {
      "id": "APTS-SC-004",
      "domain": "Safety Controls",
      "tier": 1,
      "classification": "MUST",
      "title": "Rate Limiting, Bandwidth, and Payload Constraints"
    },
    {
      "id": "APTS-SC-005",
      "domain": "Safety Controls",
      "tier": 2,
      "classification": "SHOULD",
      "title": "Cascading Failure Prevention in Interconnected Systems"
    },
    {
      "id": "APTS-SC-006",
      "domain": "Safety Controls",
      "tier": 2,
      "classification": "MUST",
      "title": "Threshold Escalation Workflow (Automated \u2192 Approval \u2192 Prohibited)"
    },
    {
      "id": "APTS-SC-007",
      "domain": "Safety Controls",
      "tier": 2,
      "classification": "MUST",
      "title": "Cumulative Risk Scoring with Time-Based Decay"
    },
    {
      "id": "APTS-SC-008",
      "domain": "Safety Controls",
      "tier": 3,
      "classification": "SHOULD",
      "title": "Threshold Configuration with Schema Validation"
    },
    {
      "id": "APTS-SC-009",
      "domain": "Safety Controls",
      "tier": 1,
      "classification": "MUST",
      "title": "Kill Switch"
    },
    {
      "id": "APTS-SC-010",
      "domain": "Safety Controls",
      "tier": 1,
      "classification": "MUST",
      "title": "Health Check Monitoring, Threshold Adjustment, and Automatic Halt"
    },
    {
      "id": "APTS-SC-011",
      "domain": "Safety Controls",
      "tier": 2,
      "classification": "MUST",
      "title": "Condition-Based Automated Termination"
    },
    {
      "id": "APTS-SC-012",
      "domain": "Safety Controls",
      "tier": 2,
      "classification": "MUST",
      "title": "Network-Level Circuit Breaker"
    },
    {
      "id": "APTS-SC-013",
      "domain": "Safety Controls",
      "tier": 3,
      "classification": "SHOULD",
      "title": "Time-Based Automatic Termination with Operator Override"
    },
    {
      "id": "APTS-SC-014",
      "domain": "Safety Controls",
      "tier": 2,
      "classification": "MUST",
      "title": "Reversible Action Tracking and Rollback"
    },
    {
      "id": "APTS-SC-015",
      "domain": "Safety Controls",
      "tier": 1,
      "classification": "MUST",
      "title": "Post-Test System Integrity Validation"
    },
    {
      "id": "APTS-SC-016",
      "domain": "Safety Controls",
      "tier": 2,
      "classification": "MUST",
      "title": "Evidence Preservation and Automated Cleanup"
    },
    {
      "id": "APTS-SC-017",
      "domain": "Safety Controls",
      "tier": 2,
      "classification": "MUST",
      "title": "External Watchdog and Operator Notification"
    },
    {
      "id": "APTS-SC-018",
      "domain": "Safety Controls",
      "tier": 2,
      "classification": "MUST",
      "title": "Incident Containment and Recovery"
    },
    {
      "id": "APTS-SC-019",
      "domain": "Safety Controls",
      "tier": 2,
      "classification": "MUST",
      "title": "Execution Sandbox and Containment Boundary Integrity"
    },
    {
      "id": "APTS-SC-020",
      "domain": "Safety Controls",
      "tier": 1,
      "classification": "MUST",
      "title": "Action Allowlist Enforcement External to the Model"
    },
    {
      "id": "APTS-HO-001",
      "domain": "Human Oversight",
      "tier": 1,
      "classification": "MUST",
      "title": "Mandatory Pre-Approval Gates for Autonomy Levels L1 and L2"
    },
    {
      "id": "APTS-HO-002",
      "domain": "Human Oversight",
      "tier": 1,
      "classification": "MUST",
      "title": "Real-Time Monitoring and Intervention Capability"
    },
    {
      "id": "APTS-HO-003",
      "domain": "Human Oversight",
      "tier": 1,
      "classification": "MUST",
      "title": "Decision Timeout and Default-Safe Behavior"
    },
    {
      "id": "APTS-HO-004",
      "domain": "Human Oversight",
      "tier": 1,
      "classification": "MUST",
      "title": "Authority Delegation Matrix"
    },
    {
      "id": "APTS-HO-005",
      "domain": "Human Oversight",
      "tier": 2,
      "classification": "MUST",
      "title": "Delegation Chain-of-Custody and Decision Audit Trail"
    },
    {
      "id": "APTS-HO-006",
      "domain": "Human Oversight",
      "tier": 1,
      "classification": "MUST",
      "title": "Graceful Pause Mechanism with State Preservation"
    },
    {
      "id": "APTS-HO-007",
      "domain": "Human Oversight",
      "tier": 1,